levelValue,URI,package,label,comment
0,domain#000000,domain#000000,Negligible,12345678123456781234567812345678123456781234567812345678123456781234567812345678123456781234567812345678123456781234567812345678123456781234567812345678123456781234567812345678123456781234567812345678123456781234567812345678123456781234567812345678123456781234567812345678123456781234567812345678123456781234567812345678
0,domain#Negligible,,Negligible,The possibility can be ignored.
1,domain#LikelihoodVeryLow,,Very Low,Rare within the lifetime of a typical system.
2,domain#LikelihoodLow,,Low,Possible but not inevitable within the lifetime of a typical system.
3,domain#LikelihoodMedium,,Medium,Expected every year or so.
4,domain#LikelihoodHigh,,High,Expected within hours to days.
5,domain#LikelihoodVeryHigh,,Very High,Expected within minutes.
