package,URI,label,comment,usesLoopback,usesParallel
package#Network,domain#R-HP,HP,Finds a Process and its Host.,FALSE,FALSE
package#Network,domain#R-HPAC,HPAC,Finds a Process running on a Host in a Space and the associated process access context.,FALSE,FALSE
package#Network,domain#R-HPHLS,HPHLS,Finds a logical subnet to which is connected a host that directly is or indirectly has a physical host.,FALSE,FALSE
package#Network,domain#R-HprL3SAC,HprL3SAC,"Finds a Layer 3 LogicalSubnet provided by a Host, along with an associated network access context.",FALSE,FALSE
package#Network,domain#R-HprLS,HprLS,Finds a LogicalSubnet provided by a Host.,FALSE,FALSE
package#Network,domain#R-HprLSAC,HprLSAC,Finds a LogicalSubnet provided by a Host and an associated network access context.,FALSE,FALSE
package#Network,domain#R-HRASuPcC,HRASuPcC,"Finds a host running a remote access service that launches a process which is used by a client that it also controls, implying the client forwards credentials to the process.",FALSE,TRUE
package#Network,domain#R-HRASuPCcS,HRASuPCcS,"Finds a host running a remote access service that launches a process which is used by a client where both it and the client are controlled by the same authenticator, implying the client forwards credentials obtained from the authenticator to the process.",FALSE,FALSE
package#Network,domain#R-HRASuPcS,HRASuPcS,"Finds a host running a remote access service that launches a process which uses a service by which it is also controlled, implying that the process uses forwarded credentials to access the service.",FALSE,TRUE
package#Network,domain#R-HRASuPScS,HRASuPScS,"Finds a host running a remote access service that launches a process which uses a service, where the service and the process are controlled by the same authenticator, implying that the process accesses the service using a token shared with it by a client.",FALSE,FALSE
package#Network,domain#R-HuE,HuE,Finds a human interacting with an email client.,FALSE,FALSE
package#Network,domain#R-HuHE,HuHE,Finds a human interacting with an email client running on a host.,FALSE,FALSE
package#Network,domain#R-HuHE2AC,HuHE2AC,"Finds a human interacting directly with an email client running on a host in a space, plus the associated location access context.",FALSE,FALSE
package#Network,domain#R-Hui2H,Hui2H,Finds a physical Host with two interactive users.,FALSE,FALSE
package#Network,domain#R-HuiCH,HuiCH,Finds a Human interacting with a console host.,FALSE,FALSE
package#Network,domain#R-HuiCHLnS,HuiCHLnS,Finds a human interacting with a console host and a login service running on a possibly remote host.,FALSE,FALSE
package#Network,domain#R-HuiDH,HuiDH,Finds a Human interacting with a Dumb Host.,FALSE,FALSE
package#Network,domain#R-HuiH,HuiH,Finds a Human interacting with a Host.,FALSE,FALSE
package#Network,domain#R-HuiHAC,HuiHAC,Finds a Human interacting with a host that runs an authentication client.,FALSE,FALSE
package#Network,domain#R-HuiHP,HuiHP,Finds a Human interacting with a Process running on a Host.,FALSE,FALSE
package#Network,domain#R-HuiHPSP,HuiHPSP,Finds a Human interacting with a Process running on an interactive Host located in a private space.,FALSE,FALSE
package#Network,domain#R-HuiHRAC,HuiHRAC,Finds a Human interacting with a host that runs a remote access client.,FALSE,FALSE
package#Network,domain#R-HuiHS,HuiHS,Finds a Human interacting with a Host located in a space.,FALSE,FALSE
package#Network,domain#R-HuiHSt,HuiHSt,Finds a Human interacting with a Host and their employer.,FALSE,FALSE
package#Network,domain#R-HuiP,HuiP,Finds a Human using an interactive Process.,FALSE,FALSE
package#Network,domain#R-HuiPCHS,HuiPCHS,Finds a Human interacting with a Process running on a Console Host located in a space.,FALSE,FALSE
package#Network,domain#R-HuiPDaS,HuiPDaS,Finds a Human that uses a personal device and has access to a space.,FALSE,FALSE
package#Network,domain#R-HuiPH,HuiPH,Finds a Human interacting with a Personal Host.,FALSE,FALSE
package#Network,domain#R-HuiPSt,HuiPSt,Finds a Human using an interactive Process and their employer.,FALSE,FALSE
package#Network,domain#R-HuirP,HuirP,Finds a Human interacting (possibly remotely) with a Process.,FALSE,FALSE
package#Network,domain#R-HuirRACP,HuirRACP,Finds a Human interacting remotely with a Process via a Remote Access Clent which remotely uses the Process.,FALSE,FALSE
package#Network,domain#R-HumCH,HumCH,Finds a Human managing a Fixed Console Host.,FALSE,FALSE
package#Network,domain#R-HumCHS,HumCHS,Finds a Human interactively managing a Host located in a space via its console.,FALSE,TRUE
package#Network,domain#R-HumH,HumH,Finds a Human managing a Host.,FALSE,FALSE
package#Network,domain#R-HumHcS,HumHcS,Finds a human managing a host that has a remote management service (which may be a Login service).,FALSE,FALSE
package#Network,domain#R-HumHP,HumHP,Finds a Human managing a host running a process.,FALSE,FALSE
package#Network,domain#R-HumHRAS,HumHRAS,Finds a human managing a host that has a root privileged remote access service.,FALSE,FALSE
package#Network,domain#R-HumHSt,HumHSt,Finds a Human managing a Host and their employer.,FALSE,FALSE
package#Network,domain#R-HumP,HumP,Finds a Human managing a Process.,FALSE,FALSE
package#Network,domain#R-HumPH,HumPH,Finds a Human managing a process running on a host.,FALSE,FALSE
package#Network,domain#R-HumSH,HumSH,Finds a Human managing a Shell Host.,FALSE,FALSE
package#Network,domain#R-HuoH,HuoH,Finds a Human operating a Host.,FALSE,FALSE
package#Network,domain#R-HuPCH,HuPCH,Finds a Human interacting with a Process running on an Interactive Host.,FALSE,FALSE
package#Network,domain#R-HuRACP,HuRACP,Finds a human interacting with a remote access client on a local host that is remotely using a process.,FALSE,FALSE
package#Network,domain#R-HuSP,HuSP,Finds a human user interacting with a smartphone.,FALSE,FALSE
package#Network,domain#R-HuwStmH,HuwStmH,Finds a Human managing a Host and working for an Employer.,FALSE,FALSE
package#Network,domain#R-HuwStmP,HuwStmP,Finds a Human managing a Process and working for an Employer.,FALSE,FALSE
package#Network,domain#R-IcP,IcP,Finds a Process controlling an Internet class subnet.,FALSE,FALSE
package#Network,domain#R-Internet,Internet,Finds an Internet class network.,FALSE,FALSE
package#Network,domain#R-IpH,IpH,Finds a Host providing an Internet class subnet.,FALSE,FALSE
package#Network,domain#R-LnScP,LnScP,Finds a login service controlling access to a process.,FALSE,FALSE
package#Network,domain#R-LnSucP,LnSucP,Finds a remote access service using a process to which it forwards credentials.,FALSE,TRUE
package#Network,domain#R-LnSuP,LnSuP,Finds a login service using a process.,FALSE,FALSE
package#Network,domain#R-LS,LS,Finds a solo Logical Subnet.,FALSE,FALSE
package#Network,domain#R-MHC,MHC,Finds a solo Mobile Console Host.,FALSE,FALSE
package#Network,domain#R-MHcIS,MHcIS,Finds a Mobile Console Host in a Public Space connected to the Internet.,FALSE,FALSE
package#Network,domain#R-MHHS,MHHS,Finds a Host whose physical host is a Mobile Client that may be in a Space.,FALSE,FALSE
package#Network,domain#R-P,P,Finds a solo Process.,FALSE,FALSE
package#Network,domain#R-PC,PC,Finds a physical cluster host.,FALSE,FALSE
package#Network,domain#R-PccP,PccP,"Finds two processes, each of which controls the other.",FALSE,TRUE
package#Network,domain#R-PcH,PcH,Finds a Process that controls a Host.,FALSE,FALSE
package#Network,domain#R-PcLS,PcLS,Finds a Process that controls a network.,FALSE,FALSE
package#Network,domain#R-PCPHLSS,PCPHLSS,"Finds a Process location access context and the related process, host and space and one subnet to which the host is connected. Note that the role names are not the ones usually used because this pattern feeds into a CP where the INS should follow the sequence Host-Process-Subnet.",FALSE,FALSE
package#Network,domain#R-PcSHLnS,PcSHLnS,Finds a Process controlling a Shell Host that runs a Remote Access Service.,FALSE,FALSE
package#Network,domain#R-PcWH,PcWH,"Finds a WiFiLAN and its local implementation, plus a controlling process.",FALSE,FALSE
package#Network,domain#R-PH,PH,Finds a solo physical host.,FALSE,FALSE
package#Network,domain#R-PH2,PH2,Finds a process with two hosts.,FALSE,FALSE
package#Network,domain#R-PHH,PHH,Finds a host that directly is or indirectly has a physical host.,FALSE,FALSE
package#Network,domain#R-PHHPS,PHHPS,Finds a process running on a host that can be accessed from a space.,FALSE,FALSE
package#Network,domain#R-PHHS,PHHS,Finds a host that directly is or indirectly has a physical host in a space.,FALSE,FALSE
package#Network,domain#R-PHLSS,PHLSS,Finds a host that directly is or indirectly has a physical host in a space and is connected to a logical subnet accessible from that space.,FALSE,FALSE
package#Network,domain#R-PHS,PHS,Finds a Physical Host located in a Space.,FALSE,FALSE
package#Network,domain#R-PMHHS,PMHHS,"Finds a Process running on a host whose physical host is a Mobile Console Host, which may be located in a Space.",FALSE,FALSE
package#Network,domain#R-PS,PS,Finds a solo Physical Subnet.,FALSE,FALSE
package#Network,domain#R-RAC,RAC,Finds a remote access client.,FALSE,FALSE
package#Network,domain#R-RACuHRASP,RACuHRASP,"Finds a host running a process and a remote access service that uses the process, and is used by a remote access client.",FALSE,FALSE
package#Network,domain#R-RACuP,RACuP,Finds a Remote Access Client using a Process.,FALSE,FALSE
package#Network,domain#R-RACuRHRASP,RACuRHRASP,"Finds a host running a process and a remote access service that uses the process, where both are used remotely by a remote access client.",FALSE,FALSE
package#Network,domain#R-RAS,RAS,Finds a remote access service.,FALSE,FALSE
package#Network,domain#R-Rr,Rr,Finds a solo Router.,FALSE,FALSE
package#Network,domain#R-RSS,RSS,"Finds a Radio Subnet accessible from a Space, and the (abstract) hotspot or cellular network it implements locally.",FALSE,FALSE
package#Network,domain#R-RSSH,RSSH,"Finds a Radio Subnet accessible from a Space, provided by a gateway host, implementing an (abstract) hotspot or cellular network, plus a context in which the gateway provides the subnet.",FALSE,FALSE
package#Network,domain#R-RTuHP,RTuHP,Finds a Host running a Process used remotely by a Remote Terminal client.,FALSE,FALSE
package#Network,domain#R-RTuP,RTuP,Finds a remote terminal using a process plus the process host.,FALSE,FALSE
package#Network,domain#R-RTurP,RTurP,Finds a remote terminal remotely using a process plus the process host.,FALSE,FALSE
package#Network,domain#R-RTuRTuS,RTuRTuS,Finds a remote terminal using remotely another remote terminal which is using remotely a third process.,FALSE,FALSE
package#Network,domain#R-SH,SH,Finds a Shell Host.,FALSE,FALSE
package#Network,domain#R-SHAC,SHAC,Finds a Shell Host in a Space and an associated access context.,FALSE,FALSE
package#Network,domain#R-SHACP,SHACP,Finds a Process running on a Shell Host in a Space and an associated Host access context.,FALSE,FALSE
package#Network,domain#R-SHGP,SHGP,Finds a simple host running a general process.,FALSE,FALSE
package#Network,domain#R-SHLnSACP,SHLnSACP,"Finds a remote access service controlling a process running on a shell host in a space, and a location access context to the remote access service.",FALSE,FALSE
package#Network,domain#R-SHP,SHP,Finds a Process running on a shell Host.,FALSE,FALSE
package#Network,domain#R-SHPAC,SHPAC,Finds a Process running on a Shell Host in a Space and the associated process access context.,FALSE,FALSE
package#Network,domain#R-SHRLnSAC,SHRLnSAC,"Finds a remote access service controlling a shell host in a space, and a location access context to the process.",FALSE,TRUE
package#Network,domain#R-SHuPH,SHuPH,Finds a Human managing a Space in which a Fixed Host is located.,FALSE,FALSE
package#Network,domain#R-StDC,StDC,Finds a stakeholder operating a data centre.,FALSE,FALSE
package#Network,domain#R-StH,StH,Finds a stakeholder operating a Host.,FALSE,FALSE
package#Network,domain#R-StHP,StHP,Finds a Stakeholder operating a Host that runs a Process.,FALSE,FALSE
package#Network,domain#R-StS,StS,Finds a Private Space operated by a Stakeholder.,FALSE,FALSE
package#Network,domain#R-StSPH,StSPH,Finds a Private Space operated by a Stakeholder where a Fixed Host is located.,FALSE,FALSE
package#Network,domain#R-Sv,Sv,Finds a solo Server.,FALSE,FALSE
package#Network,domain#R-TH,TH,Finds a solo trivial host.,FALSE,FALSE
package#Network,domain#R-THGP,THGP,Finds a trivial host running a general process.,FALSE,FALSE
package#Network,domain#R-TP,TP,Finds a solo trivial process.,FALSE,FALSE
package#Network,domain#R-WH,WH,Finds a solo WiFiLAN which may be a hotspot.,FALSE,FALSE
package#Network,domain#R-WiFiSS,WiFiSS,"Finds a WiFi network accessible from a Space, and the subnet it implements locally.",FALSE,FALSE
package#Network,domain#R-WpHS,WpHS,"Finds a mobile host or virtual host running on it, in a space, providing a WiFi LAN.",FALSE,FALSE
package#Network,domain#R-WpHSH,WpHSH,"Finds a mobile host or virtual host running on it, in a space, providing a WiFi LAN.",FALSE,FALSE
package#Network,domain#R-WS,WS,Finds a solo WiFiLAN.,FALSE,FALSE
package#Network,domain#R-WSS,WSS,Finds a Wired Subnet accessible from a Space.,FALSE,FALSE
package#Network,domain#R-WSSH,WSSH,Finds a Wired Subnet provided by a gateway Host accessible from a Space.,FALSE,FALSE
package#NetworkConnectivity,domain#R-DDoH,DDoH,"Finds an open network path from the Internet to (but not via) a Host connected to a local subnet, and the associated gateway and target network interfaces.",FALSE,FALSE
package#NetworkConnectivity,domain#R-GHRS,GHRS,Finds a gateway providing a radio subnet to which a host is connected.,FALSE,FALSE
package#NetworkConnectivity,domain#R-GHRSi,GHRSi,"Finds a gateway providing a radio subnet to which a host is connected, where the radio subnet implements itself (i.e. it is not the local realisation of a hotspot or cellular network).",TRUE,FALSE
package#NetworkConnectivity,domain#R-GHWS,GHWS,Finds a gateway providing a wired subnet to which a host is connected.,FALSE,FALSE
package#NetworkConnectivity,domain#R-HIoH,HIoH,"Finds a Host connected to the Internet, and the associated network Interface.",FALSE,FALSE
package#NetworkConnectivity,domain#R-HLoH,HLoH,"Finds a Host connected to a Layer 2 Logical Subnet, and the associated network Interface, and a second, remote host on the same subnet.",FALSE,FALSE
package#NetworkConnectivity,domain#R-HRoH,HRoH,"Finds a Host connected to a Layer 3 Logical Subnet, and the associated network Interface, and a second, remote host on the same subnet.",FALSE,FALSE
package#NetworkConnectivity,domain#R-HRSGS,HRSGS,"Finds a host connecting to a radio subnet implementing an (abstract) hotspot or cellular network, and a gateway host located in a space that is providing the network.",FALSE,FALSE
package#NetworkConnectivity,domain#R-HSRS,HSRS,Finds a host located in a space connecting to a radio subnet implementing an (abstract) hotspot or cellular network.,FALSE,FALSE
package#NetworkConnectivity,domain#R-HSWS,HSWS,Finds a host located in a space connecting to a wired subnet.,FALSE,FALSE
package#NetworkConnectivity,domain#R-HWSGS,HWSGS,"Finds a client host connecting to a wired network, and a gateway host located in a space that is providing the network.",FALSE,FALSE
package#NetworkConnectivity,domain#R-I,I,Finds an Interface.,FALSE,FALSE
package#NetworkConnectivity,domain#R-ILSA,ILSA,Finds an Interface connecting to a Logical Subnet that implements an Abstract Subnet.,FALSE,FALSE
package#NetworkConnectivity,domain#R-INC,INC,"Finds a solo Interface, plus the associated host, subnet, and a host network access context where the interface is connected.",FALSE,FALSE
package#NetworkConnectivity,domain#R-IoH,IoH,"Finds an open network path from the Internet to (but not via) a Host connected to a local subnet, and the associated network interface and access context.",FALSE,FALSE
package#NetworkConnectivity,domain#R-L3cGcL3,L3cGcL3,"Finds a Host connected from an IP subnet to an IP subnet, both in the same space.",FALSE,FALSE
package#NetworkConnectivity,domain#R-L3cGrL3,L3cGrL3,"Finds a Host connected from an IP subnet to an IP subnet that it provides, both in the same space.",FALSE,FALSE
package#NetworkConnectivity,domain#R-L3rGcL3,L3rGcL3,"Finds a Host connected from an IP subnet to an IP subnet, the former being provided by the Host, and both in the same space.",FALSE,FALSE
package#NetworkConnectivity,domain#R-L3rGrL3,L3rGrL3,"Finds a Host providing two IP subnets, both in the same space.",FALSE,FALSE
package#NetworkConnectivity,domain#R-L3SSg2,L3SSg2,"Finds a gateway from one IP subnet to an IP subnet, along with the segment asset representing the route via the gateway.",FALSE,FALSE
package#NetworkConnectivity,domain#R-L3SSg2+b,L3SSg2+b,"Finds a gateway from one IP subnet to a second IP subnet, along with the segment asset representing the route via the gateway, where this route is blocked by default.",FALSE,FALSE
package#NetworkConnectivity,domain#R-L3SSg2AC,L3SSg2AC,"Finds a gateway from one IP subnet to an IP subnet, along with the segment asset representing the route via the gateway, and a context in which the gateway is connected to both subnets.",FALSE,FALSE
package#NetworkConnectivity,domain#R-LoH,LoH,"Detects a Host in a context where it is connected to a Layer 2 Logical Subnet, and the associated network interface.",FALSE,FALSE
package#NetworkConnectivity,domain#R-LPLS2NSg2,LPLS2NSg2,"Finds a route between subnets through a gateway where NAT is used on the return path, and a logical path traversing the forward segment.",FALSE,FALSE
package#NetworkConnectivity,domain#R-LPsLS,LPsLS,Finds a Logical Subnet at the start of a Logical Path.,FALSE,FALSE
package#NetworkConnectivity,domain#R-NoH,NoH,"Finds an open network path from a remote attacker subnet to (but not via) a Host connected to a local subnet, and the associated network interface and access context.",FALSE,FALSE
package#NetworkConnectivity,domain#R-NP,NP,Finds a network path (which may or may not be physical).,FALSE,FALSE
package#NetworkConnectivity,domain#R-NPLS,NPLS,Finds a network path that starts and ends on the same logical subnet.,FALSE,TRUE
package#NetworkConnectivity,domain#R-RIoH,RIoH,"Finds an open network path to the Internet from a Host connected to a local subnet, and the associated network interface and access context.",FALSE,FALSE
package#NetworkConnectivity,domain#R-RNoH,RNoH,"Finds an open network path to a remote attacker subnet from a Host connected to a local subnet, and the associated network interface and access context.",FALSE,FALSE
package#NetworkConnectivity,domain#R-RoH,RoH,"Finds an open network path from a remote attacker L3 subnet to (but not via) a Host connected to a local subnet, and the associated network interface and access context.",FALSE,FALSE
package#NetworkConnectivity,domain#R-RScGcRS,RScGcRS,"Finds a Physical Host connected between two WiFi subnets, both in the same space.",FALSE,FALSE
package#NetworkConnectivity,domain#R-Sg,Sg,"Finds a logical segment between two subnets, plus the associated gateway host and its inbound and outbound interfaces.",FALSE,FALSE
package#NetworkConnectivity,domain#R-SgAC,SgAC,"Finds a logical segment between two subnets, plus the associated gateway host, and a host location context where the segment is active.",FALSE,FALSE
package#NetworkConnectivity,domain#R-SgHfILS,SgHfILS,"Finds a Logical Segment via a Host routing from a Logical Subnet, and the Interface between the Host and Logical Subnet.",FALSE,FALSE
package#NetworkConnectivity,domain#R-SgHtILS,SgHtILS,"Finds a Logical Segment via a Host routing to a Logical Subnet, and the Interface between the Host and Logical Subnet.",FALSE,FALSE
package#NetworkConnectivity,domain#R-WScMcWS,WScMcWS,"Finds a Mobile Host connected between two Wired LANs, both in the same space.",FALSE,FALSE
package#NetworkConnectivityInference,domain#R-NP2LS,NP2LS,Finds a network path with a subpath that visits a subnet.,FALSE,FALSE
package#NetworkConnectivityInference,domain#R-NP2LSg,NP2LSg,Finds a network path with a subpath that traverses a logical segment.,FALSE,FALSE
package#NetworkConnectivityInference,domain#R-NP3,NP3,"Finds a Network Path with a subpath that extends a third path, which does not itself have a subpath relationship to the first.",FALSE,FALSE
package#NetworkConnectivityInference,domain#R-OPLS1,OPLS1,"Finds a zero-length Logical Path and a Path Terminator (NPE) to a Logical Subnet, where there is a Logical Route via a Gateway Host to the Subnet from some other Logical Subnet.",FALSE,TRUE
package#NetworkConnectivityInference,domain#R-OPLS2,OPLS2,"Finds a Network Path and terminator to a Logical Subnet, where there is a Logical Route to the (possibly different) Subnet at the start of the Path.",FALSE,FALSE
package#NetworkConnectivityInference,domain#R-OPPS1,OPPS1,"Finds a zero-length Physical Path and a Path Terminator (PPE) to a Physical Subnet, where there is a Logical Route via a Physical Gateway Host to the Subnet from some other Physical Subnet.",FALSE,TRUE
package#NetworkConnectivityInference,domain#R-OPPS2,OPPS2,"Finds a Physical Path and terminator to a Physical Subnet, where there is a Logical Route to the (possibly different) Subnet at the start of the Path.",FALSE,FALSE
package#PatientHarms,domain#R-HucdHupiDhd,HucdHupiDhd,A Clinician diagnosing a Patient interacts with the patient monitoring data that is Health Data to form the diagnosis.,FALSE,FALSE
package#PatientHarms,domain#R-HuctHupatDht,HuctHupatDht,"Human (Clinician) is treating a Human (Patient) by administering the treatment plan given by the Health Data, which defines the treatemnt for the Human (Patient).",FALSE,FALSE
package#PatientHarms,domain#R-HuctHupiDht,HuctHupiDht,A Clinician treating a Patient interacts with the patient treatment plan that is Health Data to take the instructed actions to treat patient.,FALSE,FALSE
package#PatientHarms,domain#R-HupatDht,HupatDht,"A Patient administering their treatment, as defined by their Health Data treatment plan, via self-care.",FALSE,TRUE
package#PatientHarms,domain#R-HupvdDhdt,HupvdDhdt,A patient viewing Health Data that defines their treatment.,FALSE,TRUE
package#Physical,domain#R-HuaSaE,HuaSaE,Finds a human with access to a space that is accessible from a public entrance space.,FALSE,FALSE
package#Physical,domain#R-HuPS,HuPS,Finds a Human with access to a Private Space.,FALSE,FALSE
package#Physical,domain#R-HuPSSt,HuPSSt,"Finds a Human with access to a Private Space, and their employer.",FALSE,FALSE
package#Physical,domain#R-PPS,PPS,Finds a Private Physical Space.,FALSE,FALSE
package#Physical,domain#R-PScSt,PScSt,Finds a private space controlled by a stakeholder.,FALSE,FALSE
package#Physical,domain#R-PSS,PSS,"Finds two spaces, one of which is accessible via the other.",FALSE,FALSE
package#Physical,domain#R-W,W,Finds a solo World asset (i.e. the inferred global public space).,FALSE,FALSE
package#Privacy,domain#R-DHuDC,DHuDC,Finds a data asset relating to a human along with a stored copy of the data.,FALSE,FALSE
package#Privacy,domain#R-DHuDF,DHuDF,Finds a data asset relating to a human along with a flowing copy of the data.,FALSE,FALSE
package#Privacy,domain#R-Hs,Hs,Finds a solo Health Sensor.,FALSE,FALSE
package#Privacy,domain#R-HuDoPS,HuDoPS,"Finds a Process that serves data relating to a Human data subject, along with its host and operator.",FALSE,FALSE
package#Privacy,domain#R-HuDP,HuDP,Finds a Process that is using Data relating to a Human data subject who is a citizen or resident in some jurisdiction.,FALSE,FALSE
package#Privacy,domain#R-HuDPoS,HuDPoS,"Finds a Stakeholder operating a Process that is using Data relating to a Human data subject via a controlling Service, where the subject operates the Service.",FALSE,FALSE
package#Privacy,domain#R-HuDPS,HuDPS,Finds a Stakeholder operating a Process that is using Data relating to a Human data subject via a controlling Service.,FALSE,FALSE
package#Privacy,domain#R-HuDSH,HuDSH,Finds a Host storing Data related to a Human subject.,FALSE,FALSE
package#Privacy,domain#R-HurH,HurH,Finds a Human with a related personal device.,FALSE,FALSE
package#Privacy,domain#R-HurSesD,HurSesD,Finds Data produced as output by a Sensor related to a Human.,FALSE,FALSE
package#Privacy,domain#R-HurTh,HurTh,"Finds a Thing relating to a Human, plus onboard data and processing.",FALSE,FALSE
package#Privacy,domain#R-HurThcD,HurThcD,Finds control input to an IoT Thing related to a Human.,FALSE,FALSE
package#Privacy,domain#R-HuwStrH,HuwStrH,Finds a Human with a related personal device and who works for an Employer.,FALSE,FALSE
package#ProcessComms,domain#R-ACDFCS,ACDFCS,"Finds a data flow that goes via a client and thence a service, and the related auth channel and data.",FALSE,FALSE
package#ProcessComms,domain#R-ACDFFC,ACDFFC,"Finds a data flow from a client to/via a service, and the associated auth channel, data and data access. The source and destination of the flow are matched twice, so they can be referred to by either role name in control strategies.",FALSE,FALSE
package#ProcessComms,domain#R-ACDFFS,ACDFFS,"Finds a data flow from a service to/via a client, and the associated channel, data and data access. Note that roles FlowsFrom and Service are matched by the same asset(s). Having two roles makes it possible to create links to control strategies using either role name.",FALSE,FALSE
package#ProcessComms,domain#R-ACDFSC,ACDFSC,"Finds a data flow that goes via a service and thence a client, and the related auth channel and data.",FALSE,FALSE
