package,URI,label,comment,usesLoopback,usesParallel
package#DataLifecycle,domain#R-PDFV,PDFV,"Change from: Finds a Data Flow protected by keys from a vault, plus the data flow source and destination processes. The destination process is matched twice so it can be referred to in either role.",FALSE,FALSE
package#DataLifecycle,domain#R-PDI,PDI,"Finds a Process that uses Data as input, or displays it to an interactive user.",FALSE,FALSE
package#DataLifecycle,domain#R-PDIDDF,PDIDDF,Finds a Process using Data as input that contains a Data Field.,FALSE,FALSE
package#DataLifecycle,domain#R-PDO,PDO,"Finds a Process that creates Data as output, or gets it from an interactive user.",FALSE,FALSE
package#DataLifecycle,domain#R-PDOScDD,PDOScDD,Finds a Data Asset controlled by a vault which is output from a Process.,FALSE,FALSE
package#DataLifecycle,domain#R-PDP,PDP,Finds a Process that implicitly or explicitly serves Data.,FALSE,FALSE
package#DataLifecycle,domain#R-PDR,PDR,Finds a Process acting as a Data Relay.,FALSE,FALSE
package#DataLifecycle,domain#R-PHHDS,PHHDS,"Finds a Physical Host located in a Space, plus data stored on the host or on a virtual host running there.",FALSE,FALSE
package#DataLifecycle,domain#R-PIP,PIP,Finds a Process that uses Data as input with no other source than a locally stored copy (so access to the data is represented by an Input Pool rather than a Data Input).,FALSE,FALSE
package#DataLifecycle,domain#R-PpDADA,PpDADA,Finds a Process processing data to create a data asset.,FALSE,FALSE
package#DataLifecycle,domain#R-PrDSH,PrDSH,Finds a Process that is receiving data of which there is a copy stored on the same host.,FALSE,FALSE
package#DataLifecycle,domain#R-PSDP,PSDP,Finds a Process that serves stored Data.,FALSE,FALSE
package#DataLifecycle,domain#R-PsDSH,PsDSH,Finds a Process serving Data of which there is a copy stored on the same host.,FALSE,FALSE
package#DataLifecycle,domain#R-PuDFDI,PuDFDI,Finds a data flow to a process that needs the data as input.,FALSE,FALSE
package#DataLifecycle,domain#R-RUIDO,RUIDO,Finds a Process that enables remote user input.,FALSE,FALSE
package#DataLifecycle,domain#R-RUODI,RUODI,Finds a Process that enables remote user output.,FALSE,FALSE
package#DataLifecycle,domain#R-ScDDPDADS,ScDDPDADS,Finds a Data Asset controlled by a vault which is outbound from a Process and fulfilled by another inbound Data Asset.,FALSE,FALSE
package#DataLifecycle,domain#R-ScDSPDADD,ScDSPDADD,Finds a Data Asset controlled by a vault which is inbound to a Process and used to fulfil another outbound Data Asset.,FALSE,FALSE
package#DataLifecycle,domain#R-ScDSPDI,ScDSPDI,Finds a Data Asset controlled by a vault which is input to a Process.,FALSE,FALSE
package#DataLifecycle,domain#R-ScDSPDIcD,ScDSPDIcD,Finds a Data Asset controlled by a vault which is input to a Process that creates output.,FALSE,FALSE
package#DataLifecycle,domain#R-SDUDADS,SDUDADS,"Finds a Service enabling access for a Data Use, where the Service writes to a local Data Copy.",FALSE,FALSE
package#DataLifecycle,domain#R-SDUDSDA,SDUDSDA,"Finds a Service enabling access for a Data Use, where the Service reads from a local Data Copy.",FALSE,FALSE
package#DataLifecycle,domain#R-StoPDA,StoPDA,Finds the Operator of a Process that accesses Data.,FALSE,FALSE
package#DataLifecycleInference,domain#R-DADSDCSDD,DADSDCSDD,"Finds an active data channel carrying a forward flow that ends at a data destination that is itself a data source, and the channel beyond that source to another destination on the same data path that can act as a data destination.",FALSE,FALSE
package#DataLifecycleInference,domain#R-DAODADInDF,DAODADInDF,Finds an output data asset fulfilling (via a data access) an input data asset that needs a field contained in the data.,FALSE,FALSE
package#DataLifecycleInference,domain#R-DAOiDADInDF,DAOiDADInDF,Finds an output data asset that includes a field contained in the data fulfilling (via a data access) an input data asset that needs the field.,FALSE,FALSE
package#DataLifecycleInference,domain#R-DAPDADF,DAPDADF,"Finds a Process receiving Data that contains a Data Field, via a Data Asset.",FALSE,FALSE
package#DataLifecycleInference,domain#R-DC1,DC1,Finds a solo Data Channel.,FALSE,FALSE
package#DataLifecycleInference,domain#R-DC2TDRfDP2,DC2TDRfDP2,Finds an active forward (output) data channel leading to a transparent data relay from which another active channel continues along the same data path.,FALSE,TRUE
package#DataLifecycleInference,domain#R-DC2TDRrDP2,DC2TDRrDP2,Finds an active reverse (input) data channel leading to a transparent data relay from which another active channel continues along the same data path.,FALSE,TRUE
package#DataLifecycleInference,domain#R-DC2xfDA2,DC2xfDA2,Finds a forward Data Channel from a Data Source that extends another Data Channel to a Data Destination.,FALSE,FALSE
package#DataLifecycleInference,domain#R-DC2xrDA2,DC2xrDA2,Finds a reverse Data Channel from a Data Destination that extends another Data Channel to a Data Source.,FALSE,FALSE
package#DataLifecycleInference,domain#R-DC3,DC3,Finds a data channel that extends a second channel that extends a third channel.,FALSE,FALSE
package#DataLifecycleInference,domain#R-DC3xf,DC3xf,Finds an active forward data channel that extends a second channel that extends a third channel (meaning there are transparent relay processes between the channels).,FALSE,FALSE
package#DataLifecycleInference,domain#R-DC3xr,DC3xr,Finds an active reverse data channel that extends a second channel that extends a third channel (meaning there are transparent relay processes between the channels).,FALSE,FALSE
package#DataLifecycleInference,domain#R-DCDFDF,DCDFDF,Finds a Data Flow containing a Data Field for which there is a Data Cache.,FALSE,TRUE
package#DataLifecycleInference,domain#R-DDDCDP2,DDDCDP2,"Finds a Data Destination for which there is a Data Channel to a next Process, which uses a Data Path that extends another Data Path to another Process.",FALSE,FALSE
package#DataLifecycleInference,domain#R-DDDCDS2P,DDDCDS2P,"Finds a Data Source fulfilling a Data Destination, with an active reverse data channel to the destination and a data channel from the source, plus the associated processes and data paths.",FALSE,TRUE
package#DataLifecycleInference,domain#R-DDDCSDS,DDDCSDS,"Finds a data input client acting as a data destination, with a previously identifed potential data source that has an onward data channel to a service that can act as a data source. Should this be constrained to lie on the same data path?",FALSE,TRUE
package#DataLifecycleInference,domain#R-DDDPS,DDDPS,Finds a Data Path from a Process that is a Data Destination to a Service.,FALSE,FALSE
package#DataLifecycleInference,domain#R-DIDCSDS,DIDCSDS,"Finds a data input client acting as a data destination, and having a data channel to a service that may act as a data source.",FALSE,FALSE
package#DataLifecycleInference,domain#R-DODCSDD,DODCSDD,"Finds a data output process that acts as a data source, and having a data channel to a service that can act as a data destination.",FALSE,FALSE
package#DataLifecycleInference,domain#R-DP1,DP1,Finds a solo Data Path.,FALSE,FALSE
package#DataLifecycleInference,domain#R-DP3,DP3,Finds a data path which extends a second path which extends a third path.,FALSE,FALSE
package#DataLifecycleInference,domain#R-DSDAfDD,DSDAfDD,"Finds a Data Destination with a possible data source that itself has a source, and a data channel to the possible data source from a data relay that is also a possible data source.",FALSE,TRUE
package#DataLifecycleInference,domain#R-DSDCDD2P,DSDCDD2P,"Finds a Data Source fulfilling a Data Destination, with an active forward data channel to the source and a data channel from the destination, plus the associated processes and data paths.",FALSE,TRUE
package#DataLifecycleInference,domain#R-DSDCDP2,DSDCDP2,"Finds a Data Source for which there is a Data Channel to a next Process, which uses a Data Path that extends another Data Path to another Process.",FALSE,FALSE
package#DataLifecycleInference,domain#R-DSDDF,DSDDF,Finds a Data Copy of a Data asset containing a Data Field.,FALSE,FALSE
package#DataLifecycleInference,domain#R-DSDPS,DSDPS,"Finds a data path from a process to a service, where the process is a source of the data.",FALSE,FALSE
package#DataLifecycleInference,domain#R-FwdDFf2DP2P,FwdDFf2DP2P,"Finds an outbound Data Flow from one (longer) data path to a second (shorter) data path, and a data path which is a subset of the first, and of which the second is a subset, plus the two adjacent processes at the end of that in between data path.",FALSE,FALSE
package#DataLifecycleInference,domain#R-FwdDFfDP2P,FwdDFfDP2P,Finds an outbound (forward) data flow from a process on a data path leading to that process.,FALSE,FALSE
package#DataLifecycleInference,domain#R-FwdDFtDP2P,FwdDFtDP2P,Finds an outbound (forward) data flow to a process on a data path leading to that process.,FALSE,FALSE
package#DataLifecycleInference,domain#R-HDS2DPfDA,HDS2DPfDA,"Finds a Host with a stored copy of data at which there are two processes, one of which writes to the data, and a data source for this.",FALSE,FALSE
package#DataLifecycleInference,domain#R-HDSPDIfDA,HDSPDIfDA,Finds a data input that is a destination for data from a source and used by a process whose host stores a copy of the data.,FALSE,FALSE
package#DataLifecycleInference,domain#R-HSDADPDXP,HSDADPDXP,"Finds a service with a data access at the end of a data path process that exchanges data with a second process, where both processes have the same Host.",FALSE,FALSE
package#DataLifecycleInference,domain#R-HSDADPPDXP,HSDADPPDXP,"Finds a service with a data access to which there is a data path from a process that exchanges data with a third process, where all three processes have the same Host.",FALSE,FALSE
package#DataLifecycleInference,domain#R-PDODAnDF,PDODAnDF,"Finds a process creating data, the data access asset (a data output), and fulfilled output data asset, where the output asset needs a field.",FALSE,FALSE
package#DataLifecycleInference,domain#R-PTDR,PTDR,Finds a temporary data relay asset and the associated process and data.,FALSE,FALSE
package#DataLifecycleInference,domain#R-RADCSDD,RADCSDD,"Finds a remote access client acting as a data source, and having a data channel to a service that can act as a data destination.",FALSE,FALSE
package#DataLifecycleInference,domain#R-RADCSDS,RADCSDS,"Finds a remote access client acting as a data destination, and having a data channel to a service that can act as a data source.",FALSE,FALSE
package#DataLifecycleInference,domain#R-RevDFf2DP2P,RevDFf2DP2P,"Finds an inbound Data Flow from one (longer) data path to a second (shorter) data path, and a data path which is a subset of the first, and of which the second is a subset, plus the two adjacent processes at the end of that in between data path.",FALSE,FALSE
package#DataLifecycleInference,domain#R-RevDFfDP2P,RevDFfDP2P,Finds an inbound (reverse) data flow to a process on a data path leading to that process.,FALSE,FALSE
package#DataLifecycleInference,domain#R-RevDFtDP2P,RevDFtDP2P,Finds an inbound (reverse) data flow from a process on a data path leading from that process.,FALSE,FALSE
package#DataLifecycleInference,domain#R-SDADPDXP,SDADPDXP,Finds a service with a data access at the end of a data path that exchanges data with a second process.,FALSE,FALSE
package#DataLifecycleInference,domain#R-SDADPDXPRAC,SDADPDXPRAC,"Finds a service at the end of a data path that exchanges data with a second process, and there is a remote access client using remotely both processes.",FALSE,FALSE
package#DataLifecycleInference,domain#R-SDADPDXRAC,SDADPDXRAC,Finds a service at the end of a data path that exchanges data with a remote access client.,FALSE,FALSE
package#DataLifecycleInference,domain#R-SDADPPDXP,SDADPPDXP,Finds a service with a data access to which there is a data path from a process that exchanges data with a third process.,FALSE,FALSE
package#DataLifecycleInference,domain#R-SDADPPDXPRAC,SDADPPDXPRAC,"Finds a service with a data access to which there is a data path from a process that exchanges data with a third process, and there is a remote access client using remotely the second and third processes.",FALSE,FALSE
package#DataLifecycleInference,domain#R-SDADPPDXRAC,SDADPPDXRAC,Finds a service with a data access to which there is a data path from a process that exchanges data with a remote access client.,FALSE,FALSE
package#DataStructure,domain#R-PpDDF,PpDDF,"Finds a Process, processing Data which contains a Data Field.",FALSE,FALSE
package#GDPR,domain#R-HuSDPoS,HuSDPoS,"Finds a Stakeholder operating a Process that is using Special Category Data relating to a Human data subject, where the subject operates the Service providing (and controlling) access to the data.",FALSE,FALSE
package#GDPR,domain#R-HuSDPS,HuSDPS,Finds a Stakeholder operating a Process that is using Special Category Data relating to a Human data subject.,FALSE,FALSE
package#GDPR,domain#R-NDFHu,NDFHu,Finds nationally regulated personal data being transferred across a border.,FALSE,FALSE
package#IoT,domain#R-Co,Co,Finds a solo Controller.,FALSE,FALSE
package#IoT,domain#R-CoPD,CoPD,Finds a Controller and its control input data.,FALSE,FALSE
package#IoT,domain#R-CoPDS,CoPDS,Finds a Controller with its stored control input data.,FALSE,FALSE
package#IoT,domain#R-DcTh,DcTh,Finds an IoT Thing and its control input Data.,FALSE,FALSE
package#IoT,domain#R-DScSePD,DScSePD,"Finds a Sensor with its onboard process and output data, and its stored copy of control input data.",FALSE,FALSE
package#IoT,domain#R-HuiCo,HuiCo,"Finds the control input for an IoT Controller, which is being used interactively by a Human.",FALSE,FALSE
package#IoT,domain#R-HuiSe,HuiSe,"Finds the control input and sensed output for an IoT Sensor, which is being used interactively by a Human, plus the interactive process that creates the output.",FALSE,FALSE
package#IoT,domain#R-HuiThaS,HuiThaS,Finds a Human that uses an IoT Thing and has access to a space.,FALSE,FALSE
package#IoT,domain#R-HumThP,HumThP,Finds a Human managing a Thing with an onboard process.,FALSE,FALSE
package#IoT,domain#R-IoT,IoT,"Finds a solo IoT Thing. Not used at present, but reserved for a future extension.",FALSE,FALSE
package#IoT,domain#R-PaCo,PaCo,"Finds a client Process that amends an IoT Controller, along with its control input Data and onboard  communication Process.",FALSE,FALSE
package#IoT,domain#R-PcSe,PcSe,"Finds a client Process that alters control input to an IoT Sensor, along with its onboard simple communication Process and Data.",FALSE,FALSE
package#IoT,domain#R-PpSe,PpSe,"Finds a client Process that polls an IoT Sensor, along with its onboard simple communication Process and Data.",FALSE,FALSE
package#IoT,domain#R-PrSe,PrSe,"Finds a an IoT Sensor sending data to a Process, along with the onboard simple communication Process and Data.",FALSE,FALSE
package#IoT,domain#R-PuCo,PuCo,"Finds a client Process that updates an IoT Controller, along with its control input Data and onboard  communication Process.",FALSE,FALSE
package#IoT,domain#R-PuSe,PuSe,"Finds a client Process that reads data from an IoT Sensor, along with its onboard simple communication Process and Data.",FALSE,FALSE
package#IoT,domain#R-Se,Se,Finds a solo Sensor.,FALSE,FALSE
package#IoT,domain#R-SePD,SePD,Finds a Sensor with its onboard process and data.,FALSE,FALSE
package#IoT,domain#R-SesD,SesD,Finds a Sensor and its sensed Data.,FALSE,FALSE
package#IoT,domain#R-SHuTh,SHuTh,Finds a Human managing a Space in which a Thing is located.,FALSE,FALSE
package#Legal,domain#R-DFHu,DFHu,Finds the subject of personal data being transferred across a border.,FALSE,FALSE
package#Legal,domain#R-DSHu,DSHu,Finds the subject personal data being communicated across a border.,FALSE,FALSE
package#Legal,domain#R-JuHP,JuHP,Finds a host subject to a jurisdiction that is hosting a process.,FALSE,FALSE
package#Legal,domain#R-JuPHS,JuPHS,Finds a host that runs on or is a physical host located in a space subject to a jurisdiction.,FALSE,FALSE
package#Legal,domain#R-JuSS,JuSS,Finds a space subject to a jurisdiction which is the entrance to another space.,FALSE,FALSE
package#LocalDeviceConnectivity,domain#R-BPcGcBP,BPcGcBP,Finds a Bluetooth device paired with two other devices.,FALSE,FALSE
package#LocalDeviceConnectivity,domain#R-HBISG,HBISG,Finds a pair of hosts pairing via Bluetooth in a Space.,FALSE,FALSE
package#LocalDeviceConnectivity,domain#R-HBTTHS,HBTTHS,Finds a Host in a Space that accepts pairing via Bluetooth with a TrivialHost.,FALSE,FALSE
package#LocalDeviceConnectivity,domain#R-HL1H,HL1H,"Finds two hosts connected via a Bluetooth or USB pair, and the space in which this connection is established.",FALSE,FALSE
package#LocalDeviceConnectivity,domain#R-HL1HS,HL1HS,"Finds two hosts in a space connected via a Bluetooth or USB pair, and the associated location access contexts.",FALSE,FALSE
package#LocalDeviceConnectivity,domain#R-HpBRH,HpBRH,Finds two Physical Hosts that are paired over Bluetooth.,FALSE,FALSE
package#LocalDeviceConnectivity,domain#R-HpURH,HpURH,Finds two Physical Hosts that are paired over USB.,FALSE,FALSE
package#LocalDeviceConnectivity,domain#R-HuiHBTTH,HuiHBTTH,Finds a Human using a Host paired with a TrivialHost via Bluetooth.,FALSE,FALSE
package#LocalDeviceConnectivity,domain#R-HuiHUSBTH,HuiHUSBTH,Finds a Human using a Host paired with a TrivialHost via USB.,FALSE,FALSE
package#LocalDeviceConnectivity,domain#R-HUISG,HUISG,"Finds a pair of hosts pairing via USB, and the space in which they are located.",FALSE,FALSE
package#LocalDeviceConnectivity,domain#R-HumHBTTH,HumHBTTH,Finds a Human managing a Host paired with a TrivialHost via Bluetooth.,FALSE,FALSE
package#LocalDeviceConnectivity,domain#R-HumHUSBTH,HumHUSBTH,Finds a TrivialHost paired via Bluetooth with another host managed by a Human.,FALSE,FALSE
package#LocalDeviceConnectivity,domain#R-HumTHS,HumTHS,Finds a Human managing a Trivial Host located in a space.,FALSE,FALSE
package#LocalDeviceConnectivity,domain#R-HUSBTHS,HUSBTHS,Finds a Host in a Space that accepts pairing via USB with a TrivialHost.,FALSE,FALSE
package#LocalDeviceConnectivity,domain#R-L1cGcL3,L1cGcL3,"Finds a physical host with a pairing connection that is also connected to an IP subnet, all in the same space.",FALSE,FALSE
package#LocalDeviceConnectivity,domain#R-L1rGcL3,L1rGcL3,"Finds a Bluetooth or USB device connected from a host to an IP subnet, all in the same space.",FALSE,FALSE
package#LocalDeviceConnectivity,domain#R-L1SSg2,L1SSg2,"Finds a gateway between layer 1 subnets (i.e. Bluetooth or USB connections), along with the forward and return path segments via the gateway.",FALSE,FALSE
package#LocalDeviceConnectivity,domain#R-L1SSg2AC,L1SSg2AC,"Finds a gateway between layer 1 subnets (i.e. Bluetooth or USB connections), along with the segment asset representing the path via the gateway, and a context in which the gateway is connected to both subnets.",FALSE,FALSE
package#LocalDeviceConnectivity,domain#R-L3cGcL1,L3cGcL1,"Finds a Physical Host gateway on an IP subnet with a paring connection, all in the same space.",FALSE,FALSE
package#LocalDeviceConnectivity,domain#R-L3cGrL1,L3cGrL1,"Finds a USB/Bluetooth device connected from an IP subnet to a Host, all in the same space.",FALSE,FALSE
package#LocalDeviceConnectivity,domain#R-LTethSg2,LTethSg2,"Finds a Host connected via a layer 1 subnet (i.e., Bluetooth or USB) connection and a tethered gateway to an IP subnet, plus the forward and reverse path segment via the gateway.",FALSE,FALSE
package#LocalDeviceConnectivity,domain#R-LTethSg2AC,LTethSg2AC,"Finds a Host connected via a layer 1 subnet (i.e., Bluetooth or USB) connection and a tethered gateway to an IP subnet, plus the forward and reverse path segment via the gateway, and a context in which the gateway is connected to both subnets.",FALSE,FALSE
package#LocalDeviceConnectivity,domain#R-LTRevSg2,LTRevSg2,"Finds a Host connected via a layer 1 subnet (i.e., Bluetooth or USB) connection and a reverse tethered gateway to an IP subnet, and the forward path segment via the gateway.",FALSE,FALSE
package#LocalDeviceConnectivity,domain#R-LTRevSg2AC,LTRevSg2AC,"Finds a Host connected via a layer 1 subnet (i.e., Bluetooth or USB) connection and a reverse tethered gateway to an IP subnet, and the forward path segment via the gateway, and a context in which the gateway is connected to both subnets.",FALSE,FALSE
package#LocalDeviceConnectivity,domain#R-UHDpP,UHDpP,Finds Data stored on a USB Device paired with a USB Host which is running a process that handles the data.,FALSE,FALSE
package#LocalDeviceConnectivity,domain#R-UHDrP,UHDrP,"Finds Data stored on a USB Device paired with a USB Host, where the data is used by a Process running on some host.",FALSE,FALSE
package#LocalDeviceConnectivity,domain#R-UHDSrP,UHDSrP,"Finds Data stored on a USB Device paired with a USB Host running a service for the Data, where the data is used by a Process running on some host.",FALSE,FALSE
package#LocalDeviceConnectivity,domain#R-UHS,UHS,Finds a USB Host located in a Space.,FALSE,FALSE
package#LocalDeviceConnectivity,domain#R-UPcGrUP,UPcGrUP,Finds a possible USB hub between a USB device and a USB host (it provides the USB Pair from the USB Host).,FALSE,FALSE
package#LocalDeviceConnectivity,domain#R-UPrGcUP,UPrGcUP,Finds a possible USB hub between a USB host and a USB device (it provides the USB Pair from the USB Host).,FALSE,FALSE
package#LocalDeviceConnectivity,domain#R-USBD,USBD,Finds Data stored on a USB device.,FALSE,FALSE
package#LocalDeviceConnectivityInference,domain#R-LPLRTSg,LPLRTSg,Finds path traversing a route between subnets through a gateway which also has a tethering connection to the source subnet.,FALSE,FALSE
package#Network,domain#R-AC,AC,Finds a solo AuthClient.,FALSE,FALSE
package#Network,domain#R-AS,AS,Finds a solo authentication/authorisation service.,FALSE,FALSE
package#Network,domain#R-C,C,Finds a Host that represents a virtual or physical cluster.,FALSE,FALSE
package#Network,domain#R-CaS,CaS,Finds a client accessing a service.,FALSE,FALSE
package#Network,domain#R-CcuS,CcuS,Finds a client accessing a service and controlling access to the same service (which should never happen).,FALSE,TRUE
package#Network,domain#R-CH,CH,Finds a solo Console Host.,FALSE,FALSE
package#Network,domain#R-CHS,CHS,Finds a Console Host located in a Space.,FALSE,FALSE
package#Network,domain#R-CS,CS,Finds a client using a service.,FALSE,FALSE
package#Network,domain#R-CScP,CScP,Finds a client directly or indirectly accessing a service which is controlled by another process.,FALSE,FALSE
package#Network,domain#R-CuP,CuP,Finds a client accessing a service but not to get authorization decisions about 3rd parties.,FALSE,FALSE
package#Network,domain#R-CuScS,CuScS,Finds a client using a service for application or authentication and also controlled by the service.,FALSE,TRUE
package#Network,domain#R-CuSHS,CuSHS,"Finds a Host running both a Client and a Service used by the Client, in a Space.",FALSE,FALSE
package#Network,domain#R-DC,DC,Finds a solo Data Centre.,FALSE,FALSE
package#Network,domain#R-DCH,DCH,Finds a Host resourced by a DataCentre.,FALSE,FALSE
package#Network,domain#R-DCLS,DCLS,Finds a DataCentre connected to an Abstract Subnet.,FALSE,FALSE
package#Network,domain#R-DCpLS,DCpLS,"Finds a DataCentre providing a LogicalSubnet, and a router located in the data centre.",FALSE,FALSE
package#Network,domain#R-DCPS,DCPS,Finds a Process hosted directly on a Data Centre.,FALSE,FALSE
package#Network,domain#R-DCVHRS,DCVHRS,Finds a Host that is physically in a DataCentre and connected to a WiFi LAN.,FALSE,FALSE
package#Network,domain#R-DCVHWS,DCVHWS,Finds a Host that is physically in a DataCentre and connected to a Wired LAN.,FALSE,FALSE
package#Network,domain#R-DCWH,DCWH,"Finds a Data Centre with a router and wired network, in which is located another Fixed Host.",FALSE,FALSE
package#Network,domain#R-FcLSS,FcLSS,Finds a Logical Subnet to which is connected a Fixed Host (or a Virtual Host running on it) located in a Space.,FALSE,FALSE
package#Network,domain#R-FpLSS,FpLSS,Finds a Logical Subnet which is provided by a Fixed Host (or a Virtual Host running on it) located in a Space.,FALSE,FALSE
package#Network,domain#R-GH,GH,Finds a General Host.,FALSE,FALSE
package#Network,domain#R-H,H,Finds a solo Host.,FALSE,FALSE
package#Network,domain#R-HAC,HAC,Finds a Host in a Space with the associated access context.,FALSE,FALSE
package#Network,domain#R-HACP,HACP,Finds a process running on a host in a space and the host location access context.,FALSE,FALSE
package#Network,domain#R-HCHLSS,HCHLSS,Finds a Host location access context and the related host and space and one related subnet.,FALSE,FALSE
package#Network,domain#R-HcWHS,HcWHS,"Finds a WiFiLAN hotspot and its local implementation in a Space, and a host connected to the hotspot in that space.",FALSE,FALSE
package#Network,domain#R-HHu2,HHu2,Finds a Host with two interactive users.,FALSE,FALSE
package#Network,domain#R-HIUS,HIUS,Finds a Host in a Space connected to the Internet.,FALSE,FALSE
package#Network,domain#R-HL3S,HL3S,"Finds a host connected to an L3 subnet, and an associated network access context.",FALSE,FALSE
package#Network,domain#R-HLnSP,HLnSP,Finds a Login Service and a Process used by it on the same Host.,FALSE,FALSE
package#Network,domain#R-HLS,HLS,Finds a Host connected to a LogicalSubnet.,FALSE,FALSE
package#Network,domain#R-Hm2Hu,Hm2Hu,Finds a host and two humans that manage the host.,FALSE,FALSE
package#Network,domain#R-HNP,HNP,Finds a Host connected to an Abstract Subnet controlled by a Process.,FALSE,FALSE
