package,URI,label,comment,usesLoopback,usesParallel
package#ProcessComms,domain#R-ACDFTC,ACDFTC,"Finds a data flow to a client from or via a service, and the associated auth channel, data and data access. The destination of the flow is matched twice, so they can be referred to by either role name in control strategies.",FALSE,FALSE
package#ProcessComms,domain#R-ACDFTS,ACDFTS,"Finds a data flow to a service from/via a client, and the associated channel, data and data access. Note that roles FlowsTo and Service are matched by the same asset(s). Having two roles makes it possible to create links to control strategies using either role name.",FALSE,FALSE
package#ProcessComms,domain#R-ACDFVFC,ACDFVFC,"Finds a data flow encrypted with keys from a vault, flowing from a client to/via a service, and the associated auth channel, data and data access. The source and destination of the flow are matched twice, so they can be referred to by either role name in control strategies.",FALSE,FALSE
package#ProcessComms,domain#R-ACDFVFS,ACDFVFS,"Finds a data flow encrypted with keys from a vault, flowing from a service to/via a client, and the associated channel, data and data access. Note that roles FlowsFrom and Service are matched by the same asset(s). Having two roles makes it possible to create links to control strategies using either role name.",FALSE,FALSE
package#ProcessComms,domain#R-ACDFVTC,ACDFVTC,"Finds a data flow encrypted with keys from a vault, flowing to a client from a service, and the associated auth channel, data and data access. The destination of the flow is matched twice, so they can be referred to by either role name in control strategies.",FALSE,FALSE
package#ProcessComms,domain#R-ACDFVTS,ACDFVTS,"Finds a data flow encrypted with keys from a vault, flowing to a service from/via a client, and the associated channel, data and data access. Note that roles FlowsTo and Service are matched by the same asset(s). Having two roles makes it possible to create links to control strategies using either role name.",FALSE,FALSE
package#ProcessComms,domain#R-CACHcLSS,CACHcLSS,"Finds a service accessed by a client via a subnet the client is on, and an associated context for access to the client.",FALSE,FALSE
package#ProcessComms,domain#R-CACHLSS,CACHLSS,"Finds a service accessed by a client via a subnet the client need not normally be on, and an associated context for access to the client.",FALSE,FALSE
package#ProcessComms,domain#R-CACPaACS,CACPaACS,"Finds a client providing authentication credentials to a process which uses a service to validate those credentials, along with the channels between each pair of processes.",FALSE,FALSE
package#ProcessComms,domain#R-CACPzACS,CACPzACS,"Finds a client providing indirect authorization credentials to a process which uses a service to validate those credentials, along with the channels between each pair of processes.",FALSE,FALSE
package#ProcessComms,domain#R-CACS,CACS,"Finds a Client and Service with an Auth Channel between them, plus their hosts.",FALSE,FALSE
package#ProcessComms,domain#R-CACScACP,CACScACP,"Finds a client and process connected via a channel, where the client also uses another service that controls the process, along with the associated channels.",FALSE,FALSE
package#ProcessComms,domain#R-CACSSaS,CACSSaS,"Finds a channel between a client and a service used to pass authorization tokens, and a second channel from the service to another service used to validate those tokens, along with the hosts of the client and the second service.",FALSE,FALSE
package#ProcessComms,domain#R-CACSScS,CACSScS,"Finds a channel between a client and a service, where authentication on this channel is controlled by authentication on another channel from the same client to a second service, along with the hosts of the client and the second service.",FALSE,FALSE
package#ProcessComms,domain#R-CAPlISAP,CAPlISAP,Finds a client attack path via a service attack path where the former has a last interface.,FALSE,FALSE
package#ProcessComms,domain#R-CAPNPSAP,CAPNPSAP,Finds a Client Attack Path via a Service Attack Path and a Network Path.,FALSE,FALSE
package#ProcessComms,domain#R-CAPSAP,CAPSAP,Finds a Client Attack Path via a Service Attack Path.,FALSE,FALSE
package#ProcessComms,domain#R-CCAPNoS,CCAPNoS,Finds a service and its host accessed by a client via the associated client channel on a closed client attack path from a logical subnet where messages from the attacker come from the same address as those from the client.,FALSE,FALSE
package#ProcessComms,domain#R-CCCCAP,CCCCAP,Finds a Client Channel via a proxy Client Channel that goes via an Attack Path.,FALSE,FALSE
package#ProcessComms,domain#R-CCCfCCS+aFC,CCCfCCS+aFC,"Finds a Client accessing a Service via a Proxy, with the channel between the Client and Service, the channel to the first Proxy, and the client and service hosts, plus a client context in which the client can access the proxy channel.",FALSE,FALSE
package#ProcessComms,domain#R-CCCLnS,CCCLnS,"Finds a Client and Remote Access Service with a ClientChannel between them, plus their hosts.",FALSE,FALSE
package#ProcessComms,domain#R-CCCPCCS,CCCPCCS,"Finds a client accessing a reverse proxy that uses a service, via the associated client channels.",FALSE,FALSE
package#ProcessComms,domain#R-CCCS,CCCS,"Finds a Client and Service with a Client Channel between them, plus their hosts.",FALSE,FALSE
package#ProcessComms,domain#R-CCCSCCS,CCCSCCS,"Finds a client accessing a service that uses another service, via the associated client channels.",FALSE,FALSE
package#ProcessComms,domain#R-CCCSCCSDF,CCCSCCSDF,"Finds a client accessing a service that uses another service, via the associated client channels, plus a data flow from the second service to the first.",FALSE,FALSE
package#ProcessComms,domain#R-CCCSCS,CCCSCS,"Finds a Client and Service connected via a Service Channel, plus the Client Channel between them. The presence of a Service Channel means this is a direct connection (not via a reverse proxy) involving communication over a network (not via a local API or sockets).",FALSE,FALSE
package#ProcessComms,domain#R-CCCSDFCCS,CCCSDFCCS,"Finds a client accessing a service that uses another service, via the associated client channels, plus a data flow to the second service from the first.",FALSE,FALSE
package#ProcessComms,domain#R-CCCSPCCSDF,CCCSPCCSDF,"Finds a client accessing a proxy that (directly or indirectly) uses a service that uses a second service, with a data flow from the second service to the first, plus the associated client channels.",FALSE,FALSE
package#ProcessComms,domain#R-CCCSPDFCCS,CCCSPDFCCS,"Finds a client accessing a proxy that (directly or indirectly) uses a service that uses a second service, with a data flow to the second service from the first, plus the associated client channels.",FALSE,FALSE
package#ProcessComms,domain#R-CCCSPSFCS,CCCSPSFCS,"Finds a client sending a flow of data to a service via a chain of intermediaries, over which the client communications authentication or authorization credentials.",FALSE,FALSE
package#ProcessComms,domain#R-CCCSPSFSC,CCCSPSFSC,"Finds a client receiving a flow of data from a service via a chain of intermediaries, over which the client communications authentication or authorization credentials.",FALSE,FALSE
package#ProcessComms,domain#R-CCCSvLS,CCCSvLS,"Finds a Client with a Client Channel to a Service via an adjacent L2 subnet, plus their hosts.",FALSE,FALSE
package#ProcessComms,domain#R-CCCtCCS+aTS,CCCtCCS+aTS,"Finds a Client accessing a Service via a Proxy, with the channel between the Client and Service, the channel from the last Proxy, and a service context in which the service can be accessed via the proxy channel.",FALSE,FALSE
package#ProcessComms,domain#R-CCCvCCS,CCCvCCS,"Finds a Client accessing a Service via a Proxy, with the Client Channel between the Client and Service, the channel to the Proxy, plus the client and service hosts.",FALSE,FALSE
package#ProcessComms,domain#R-CCCvCCvLS,CCCvCCvLS,Finds a Client Channel from a Client process that goes via a Logical Subnet and also via another Client Channel (i.e. the client and service communicate via a credential sharing/forwarding chain).,FALSE,FALSE
package#ProcessComms,domain#R-CCDFCDAScDA,CCDFCDAScDA,"Finds a data flow from a service to an indirect client, where the client encrypts the data flow to create an outbound data asset controlled by a vault.",FALSE,FALSE
package#ProcessComms,domain#R-CCDFCS,CCDFCS,"Finds a data flow that goes via a client and thence via a service, plus the related client channel and data.",FALSE,FALSE
package#ProcessComms,domain#R-CCDFSC,CCDFSC,"Finds a data flow that goes via a service and thence a client, and the related client channel and data.",FALSE,FALSE
package#ProcessComms,domain#R-CCDFSDAScDA,CCDFSDAScDA,"Finds a data flow to a service from an indirect client, where the service encrypts the data flow to create an outbound data asset controlled by a vault.",FALSE,FALSE
package#ProcessComms,domain#R-CCDFSFC,CCDFSFC,"Finds a data flow from a client to/via a service, and the associated client channel, data and the first data step. The source of the flow is matched twice, so it can be referred to by either role name.",FALSE,FALSE
package#ProcessComms,domain#R-CCDFSFS,CCDFSFS,"Finds a data flow to/via a client from a service, and the associated client channel, data and the first data step. The source of the flow is matched twice, so it can be referred to by either role name.",FALSE,FALSE
package#ProcessComms,domain#R-CCDFSTC,CCDFSTC,"Finds a data flow to a client from/via a service, and the associated client channel, data and the last data step. The destination of the flow is matched twice, so it can be referred to by either role name.",FALSE,FALSE
package#ProcessComms,domain#R-CCDFSTS,CCDFSTS,"Finds a data flow from/via a client to a service, and the associated client channel, data and the last data step.",FALSE,FALSE
package#ProcessComms,domain#R-CCDS2FC,CCDS2FC,"Finds a data flowing from/via a client via a service, plus the associated client channel and the data steps from the client and from the service.",FALSE,FALSE
package#ProcessComms,domain#R-CCDS2TC,CCDS2TC,"Finds a data flowing to/via a client via a service, plus the associated client channel and the data steps to the client and to the service.",FALSE,FALSE
package#ProcessComms,domain#R-CCfI,CCfI,Finds a Client Channel from an Interface at the Client host.,FALSE,FALSE
package#ProcessComms,domain#R-CCS,CCS,Finds a client and service connected by a client channel.,FALSE,FALSE
package#ProcessComms,domain#R-CCSC,CCSC,Finds a client and service connected by a client channel and a service channel.,FALSE,FALSE
package#ProcessComms,domain#R-CCSCAP,CCSCAP,Finds a Client Channel via a Service Channel that goes via an Attack Path.,FALSE,FALSE
package#ProcessComms,domain#R-CCSCCP,CCSCCP,Finds a client channel via a service channel that is via a client path.,FALSE,FALSE
package#ProcessComms,domain#R-CCSCfI,CCSCfI,Finds a Client Channel via a Service Channel that goes from an Interface.,FALSE,FALSE
package#ProcessComms,domain#R-CCSCtI,CCSCtI,Finds a Client Channel via a Service Channel that goes to an Interface.,FALSE,FALSE
package#ProcessComms,domain#R-CCSCtSg,CCSCtSg,Finds a Client Channel via a Service Channel that goes via a Logical Segment.,FALSE,FALSE
package#ProcessComms,domain#R-CCSCvI,CCSCvI,Finds a Client Channel via a Service Channel that goes via an Interface.,FALSE,FALSE
package#ProcessComms,domain#R-CCSCvLS,CCSCvLS,Finds a Client Channel via a Service Channel that visits a Logical Subnet.,FALSE,FALSE
package#ProcessComms,domain#R-CCtI,CCtI,Finds a Client Channel to an Interface at the Service host.,FALSE,FALSE
package#ProcessComms,domain#R-CDBSC,CDBSC,Finds a process acting as a client to a DB in a context where the connection between them is open.,FALSE,FALSE
package#ProcessComms,domain#R-CDBSCDADS,CDBSCDADS,"Finds a process using a DB service to update data, where the data in this case may or may not normally be accessed via the process.",FALSE,FALSE
package#ProcessComms,domain#R-CDBSCDSDA,CDBSCDSDA,"Finds a process using a DB service to update data, where the data in this case may or may not normally be accessed via the process.",FALSE,FALSE
package#ProcessComms,domain#R-CDBSCDSF,CDBSCDSF,"Finds a process using data served by a DB service the process is using, and the associated client channel, host and data copy assets.",FALSE,FALSE
package#ProcessComms,domain#R-CRoS,CRoS,"Finds a Service and its Host, a Client Channel from a legitimate Client and its Host,  and a Logical Subnet used by at least one path from the client, plus the Client Path for that Client from this Subnet.",FALSE,FALSE
package#ProcessComms,domain#R-CRoSG,CRoSG,"Finds a Service and its Host, a Client Channel from a legitimate Client and its Host,  an Interface from a Gateway host to a subnet on at least one path from the Client, plus the Client Path from that Interface, and an access context for the gateway where it is on the relevant path.",FALSE,FALSE
package#ProcessComms,domain#R-CRoSI,CRoSI,"Finds a Service and its Host, a Client Channel from a legitimate Client and its Host,  an Interface from a Gateway host to a subnet on at least one path from the Client, plus the Client Path from that Interface.",FALSE,FALSE
package#ProcessComms,domain#R-CSAPNaS,CSAPNaS,Finds a host running a service and a closed service attack path to the service from a logical subnet.,FALSE,FALSE
package#ProcessComms,domain#R-CSCC,CSCC,"Finds a Client and Service with a ClientChannel between them, plus their hosts.",FALSE,FALSE
package#ProcessComms,domain#R-CSCCHu,CSCCHu,Finds a Human manager of a Service and a Client Channel to the Service from a Client.,FALSE,FALSE
package#ProcessComms,domain#R-CSCCHuSt,CSCCHuSt,"Finds a Human manager of a Service and their employer, and a Client Channel to the Service from a Client.",FALSE,FALSE
package#ProcessComms,domain#R-CSCCSC,CSCCSC,Finds a Client and Service with a Client Channel between them and a single associated Service Channel.,FALSE,FALSE
package#ProcessComms,domain#R-CSCLS,CSCLS,"Finds a client and its host and a service channel to the service via a logical subnet to which the host is connected, plus the associated process access contexts.",FALSE,FALSE
package#ProcessComms,domain#R-CSCLS+ii,CSCLS+ii,"Finds a client and its host (and physical host) and a service channel to the service via the Internet to which the host need not be connected, accessible from the World in which the host need not be located.",FALSE,FALSE
package#ProcessComms,domain#R-CSCLS-ii,CSCLS-ii,"Finds a client and its host (and physical host) and a service channel to the service via an L3 subnet to which the host need not be connected, accessible from a space in which the host need not be located.",FALSE,FALSE
package#ProcessComms,domain#R-CSCvLS,CSCvLS,"Finds a Service Channel from a client process to a service, and a logical subnet visited by it, plus the interface from which the channel enters that subnet.",FALSE,FALSE
package#ProcessComms,domain#R-CSDS,CSDS,Finds a client and service plus the associated client channel where there is a data step from the client to the service.,FALSE,FALSE
package#ProcessComms,domain#R-CSHSAC,CSHSAC,Finds a service accessed by a client and an associated context for access to the service.,FALSE,FALSE
package#ProcessComms,domain#R-CSL0H,CSL0H,"Finds a client channel whose client and service are collocated on a host, and an internal (socket) LAN provided by the host that is accessible in a space.",FALSE,TRUE
package#ProcessComms,domain#R-CSL1H2,CSL1H2,"Finds a client and service whose hosts are connected in a pair, plus their interfaces on each side.",FALSE,TRUE
package#ProcessComms,domain#R-CSL3H,CSL3H,"Finds a client channel whose client and service are collocated on a cluster host that is accessible in a space, and an L3 Subnet connecting to the cluster.",FALSE,TRUE
package#ProcessComms,domain#R-CSLS2H2,CSLS2H2,"Finds a client and service running on different hosts connected to different logical subnets that are not hotspots, and a network path between the two subnets.",FALSE,FALSE
package#ProcessComms,domain#R-CSLSH2,CSLSH2,Finds a client and service whose hosts are connected to the same logical subnet.,FALSE,TRUE
package#ProcessComms,domain#R-CucSaP,CucSaP,"Finds a Client using a Service with forwarded or shared credentials, and also using a third Process for authentication which controls the Service.",FALSE,TRUE
package#ProcessComms,domain#R-CuPiS,CuPiS,Finds a client process using a service indirectly using another service.,FALSE,FALSE
package#ProcessComms,domain#R-CuPnS,CuPnS,"Finds a client accessing a process that directly or indirectly uses a service, where the process shares or forwards client credentials and sends them to the service.",FALSE,FALSE
package#ProcessComms,domain#R-CuPuS,CuPuS,Finds a client process using a service using another service.,FALSE,FALSE
package#ProcessComms,domain#R-CuPuSCC,CuPuSCC,"Finds a client accessing a service indirectly, via one intermediary, plus the auth channels between client and service and between each and the intermediary process.",FALSE,FALSE
package#ProcessComms,domain#R-CuPvnS,CuPvnS,"Finds a client accessing a process that is in a credential forwarding chain with a service used indirectly by the client (i.e., the service is at the end of the chain).",FALSE,TRUE
package#ProcessComms,domain#R-CuPvSCC,CuPvSCC,"Finds a client accessing a service indirectly, where there is more than one intermediary, plus the first intermediary adjacent to the client, and channels between client and service and between the client and this intermediary process.",FALSE,FALSE
package#ProcessComms,domain#R-CuvS,CuvS,Finds a client indirectly accessing a process via a credential sharing/forwarding chain.,FALSE,TRUE
package#ProcessComms,domain#R-CvPuSCC,CvPuSCC,"Finds a client accessing a service via more than one intermediary, plus the last intermediary adjacent to the service, and channels between client and service and between this intermediary process and the service.",FALSE,FALSE
package#ProcessComms,domain#R-CvPvSCC,CvPvSCC,"Finds a client accessing a service via at least two intermediaries, and two intermediaries that are adjacent, and the channels between client and service and between these two intermediary processes. Note that the link from the client is to the intermediary proxy that is closer to the service, and vice versa. This guarantees that these two links will be usesIndirectly (indirect) and not accessesService (direct) in the matching system assets.",FALSE,FALSE
package#ProcessComms,domain#R-CzS,CzS,Finds a client providing authorization claims to a remote service.,FALSE,FALSE
package#ProcessComms,domain#R-CzSzP,CzSzP,Finds a client sending an authorization token to a service which uses a separate OAuth-style process to validate and exchange the token.,FALSE,FALSE
package#ProcessComms,domain#R-DDoS,DDoS,"Finds a service and client, where the communication path crosses the Internet.",FALSE,FALSE
package#ProcessComms,domain#R-DFDSCS,DFDSCS,Finds a DataFlow via a DataStep that flows via a ClientChannel in the direction client to service.,FALSE,FALSE
package#ProcessComms,domain#R-DFDSSC,DFDSSC,Finds a DataFlow via a DataStep that flows via a ClientChannel in the direction service to client.,FALSE,FALSE
package#ProcessComms,domain#R-DFrXSS,DFrXSS,"Finds human using a web browser that uses a service with a host, where the browser receives data from another process, plus the client channel between the browser and the service.",FALSE,FALSE
package#ProcessComms,domain#R-DFsXSS,DFsXSS,Finds a human using a web browser that accesses a service running on a Host and using inflowing data. The data flow destination is matched twice so it can be referred to in CSGs using different role names.,FALSE,FALSE
package#ProcessComms,domain#R-DoS,DoS,"Finds a service with its host, and a service attack path to the service from a (possibly remote) subnet.",FALSE,FALSE
package#ProcessComms,domain#R-DSrXSS,DSrXSS,"Finds human using a web browser that uses a service with a host, where the browser also uses locally stored data.",FALSE,FALSE
package#ProcessComms,domain#R-DSsXSS,DSsXSS,Finds a human using a web browser that accesses a service running on a host and using stored input data.,FALSE,FALSE
package#ProcessComms,domain#R-HLSISC,HLSISC,Finds a host connecting to a logical subnet by authenticating to a controlling service.,FALSE,FALSE
package#ProcessComms,domain#R-HPdDSCCV,HPdDSCCV,"Finds a host running a Process with write/delete access (crudd) to a locally stored data copy, plus the data access asset representing the data deserialization, and a channel to a key vault that controls the stored data.",FALSE,FALSE
package#ProcessComms,domain#R-HPrDSCCV,HPrDSCCV,"Finds a host running a Process with read access (crudr) to a locally stored data copy, plus the data access asset representing the data deserialization, and a channel to a key vault that controls the stored data.",FALSE,FALSE
package#ProcessComms,domain#R-HuCAP,HuCAP,"Finds a client attack path from a subnet, plus the associated client, service process and service host, and the service and service host managers.",FALSE,FALSE
package#ProcessComms,domain#R-HuCCCS,HuCCCS,"Finds a User of an interactive Client using a Service with a ClientChannel between them, plus their hosts.",FALSE,FALSE
package#ProcessComms,domain#R-HuDFrXSS,HuDFrXSS,"Finds human using a web browser that uses a service with a host and host manager, where the browser also uses inflowing data.",FALSE,FALSE
package#ProcessComms,domain#R-HuDFsXSS,HuDFsXSS,"Finds a human using a web browser that accesses a service which is using inflowing data and whose host has a manager. The destination of the flow is matched twice, so it can be referred to by either role name.",FALSE,FALSE
package#ProcessComms,domain#R-HuDFTCS,HuDFTCS,"Finds a Human using a Web Browser that accesses a Service, where the browser consumes a data flow that is viewed by the user, plus the client channel associated with the commnication and data flow.",FALSE,FALSE
package#ProcessComms,domain#R-HuDSrXSS,HuDSrXSS,"Finds human using a web browser that uses a service with a host and host manager, where the browser also uses locally stored data.",FALSE,FALSE
package#ProcessComms,domain#R-HuDSsXSS,HuDSsXSS,Finds a human using a web browser that accesses a service which is using stored input data and whose host has a manager.,FALSE,FALSE
package#ProcessComms,domain#R-HuDSTCS,HuDSTCS,"Finds a Human using a Web Browser that accesses a Service, where the browser consumes a locally stored data input viewed by the user, plus the client channel associated with the data use and client-service commnication.",FALSE,FALSE
package#ProcessComms,domain#R-HuHW2ACE,HuHW2ACE,"Finds a Human using a web browser running on a host to access email, when the host is located in a space, plus the associated host location access context.",FALSE,FALSE
package#ProcessComms,domain#R-HuiHCCCS,HuiHCCCS,Finds a Human using a Host to run a Process that is a Client of a Service.,FALSE,FALSE
package#ProcessComms,domain#R-HuiHrCCCS,HuiHrCCCS,Finds a Human using a Host running a Remote Access Client used to access a Process that is a Client of a Service.,FALSE,FALSE
package#ProcessComms,domain#R-HuirRACSPH,HuirRACSPH,"Finds a Human interacting remotely with a Process via a Remote Access Clent, plus the Process Host, collocated Remote Access Service, and the Client Channel between the Remote Access Client and the Remote Access Service.",FALSE,FALSE
package#ProcessComms,domain#R-HuiSP,HuiSP,Finds a Human interactively using a reverse proxy (which is not normally permitted).,FALSE,FALSE
package#ProcessComms,domain#R-HumCCCS,HumCCCS,"Finds a User managing a Client using a Service with a ClientChannel between them, plus their hosts.",FALSE,FALSE
package#ProcessComms,domain#R-HuSAP,HuSAP,"Finds a service attack path from a subnet, plus the associated service process and service host, and the service and service host managers.",FALSE,FALSE
package#ProcessComms,domain#R-HuSC,HuSC,"Finds a service channel representing a privileged communication path to a service, plus the associated service process and service host, and the service and service host managers.",FALSE,FALSE
package#ProcessComms,domain#R-HuStCCCS,HuStCCCS,"Finds the Employer of a User of an interactive Client using a Service with a ClientChannel between them, plus their hosts.",FALSE,FALSE
package#ProcessComms,domain#R-NPSCCAP,NPSCCAP,Finds an off-channel Client Attack Path via Network Path from an attacker Subnet into a Service Channel.,FALSE,FALSE
package#ProcessComms,domain#R-OCAPNoS,OCAPNoS,Finds a service and its host accessed by a client via the associated client channel on an open client attack path from a logical subnet where messages from the attacker can be distinguished from those from the client.,FALSE,FALSE
package#ProcessComms,domain#R-OSAPLaS,OSAPLaS,"Finds a host connected to an L2 subnet running a service, and an open service attack path from the subnet to the service.",FALSE,FALSE
package#ProcessComms,domain#R-OSAPNaS,OSAPNaS,Finds a host running a service and an open service attack path to the service from a logical subnet.,FALSE,FALSE
package#ProcessComms,domain#R-PCaFCSCCC,PCaFCSCCC,Finds a client channel via a service channel which is accessible to a client in a process context.,FALSE,FALSE
package#ProcessComms,domain#R-PCaTSSCAP,PCaTSSCAP,Finds an attack path path via a service channel on which a service is accessible in a process context.,FALSE,FALSE
package#ProcessComms,domain#R-PCaTSSCCC,PCaTSSCCC,Finds a client channel via a service channel which gives access to a service in a process context.,FALSE,FALSE
